<?xml version="1.0" encoding="utf-8"?>
<xs:schema elementFormDefault="qualified" xmlns:xs="http://www.w3.org/2001/XMLSchema" targetNamespace="http://www.uniovi.es" xmlns="http://www.uniovi.es">
	<xs:element name="circuito">
		<xs:complexType>
			<xs:sequence>
				<xs:element ref="nombre" />
				<xs:element ref="distancia" />
				<xs:element ref="anchura" />
				<xs:element ref="fecha" />
				<xs:element ref="hora_inicio" />
				<xs:element ref="vueltas" />
				<xs:element ref="localidad" />
				<xs:element ref="pais" />
				<xs:element ref="referecias" />
				<xs:element ref="fotos" />
				<xs:element ref="videos" />
				<xs:element ref="coordenadas" />
				<xs:element ref="tramos" />
			</xs:sequence>
		</xs:complexType>
	</xs:element>
	<xs:element name="nombre" type="xs:string" />
	<xs:element name="distancia">
		<xs:complexType>
			<xs:simpleContent>
				<xs:extension base="xs:float">
					<xs:attribute name="unidades" type="xs:string" use="required" />
				</xs:extension>
			</xs:simpleContent>
		</xs:complexType>
	</xs:element>
	<xs:element name="anchura">
		<xs:complexType>
			<xs:simpleContent>
				<xs:extension base="xs:float">
					<xs:attribute name="unidades" type="xs:string" use="required" />
				</xs:extension>
			</xs:simpleContent>
		</xs:complexType>
	</xs:element>
	<xs:element name="fecha" type="xs:date" />
	<xs:element name="hora_inicio" type="xs:time" />
	<xs:element name="vueltas">
		<xs:simpleType>
			<xs:restriction base="xs:integer">
				<xs:minInclusive value="1"></xs:minInclusive>
			</xs:restriction>
		</xs:simpleType>
	</xs:element>
	<xs:element name="localidad" type="xs:string" />
	<xs:element name="pais" type="xs:string" />
	<xs:element name="referecias">
		<xs:complexType>
			<xs:sequence>
				<xs:element minOccurs="3" maxOccurs="unbounded" ref="referecia" />
			</xs:sequence>
		</xs:complexType>
	</xs:element>
	<xs:element name="referecia" type="xs:string" />
	<xs:element name="fotos">
		<xs:complexType>
			<xs:sequence>
				<xs:element minOccurs="1" maxOccurs="5" ref="foto" />
			</xs:sequence>
		</xs:complexType>
	</xs:element>
	<xs:element name="foto">
		<xs:complexType>
			<xs:attribute name="fuente" type="xs:string" use="required" />
		</xs:complexType>
	</xs:element>
	<xs:element name="videos">
		<xs:complexType>
			<xs:sequence>
				<xs:element minOccurs="0" maxOccurs="3" ref="video" />
			</xs:sequence>
		</xs:complexType>
	</xs:element>
	<xs:element name="video">
		<xs:complexType>
			<xs:attribute name="fuente" type="xs:string" use="required" />
		</xs:complexType>
	</xs:element>
	<xs:element name="coordenadas">
		<xs:complexType>
			<xs:sequence>
				<xs:element ref="longitud" />
				<xs:element ref="latitud" />
				<xs:element ref="altitud" />
			</xs:sequence>
		</xs:complexType>
	</xs:element>
	<xs:element name="longitud">
		<xs:simpleType>
			<xs:restriction base="xs:double">
				<xs:minInclusive value="-90"></xs:minInclusive>
				<xs:maxInclusive value="90"></xs:maxInclusive>
			</xs:restriction>
		</xs:simpleType>
	</xs:element>
	<xs:element name="latitud">
		<xs:simpleType>
			<xs:restriction base="xs:double">
				<xs:minInclusive value="-90"></xs:minInclusive>
				<xs:maxInclusive value="90"></xs:maxInclusive>
			</xs:restriction>
		</xs:simpleType>
	</xs:element>
	<xs:element name="altitud">
		<xs:simpleType>
			<xs:restriction base="xs:integer">
				<xs:minInclusive value="0"></xs:minInclusive>
				<xs:maxExclusive value="8849"></xs:maxExclusive>
			</xs:restriction>
		</xs:simpleType>
	</xs:element>
	<xs:element name="tramos">
		<xs:complexType>
			<xs:sequence>
				<xs:element minOccurs="1" maxOccurs="unbounded" ref="tramo" />
			</xs:sequence>
		</xs:complexType>
	</xs:element>
	<xs:element name="tramo">
		<xs:complexType>
			<xs:sequence>
				<xs:element ref="largo" />
				<xs:element ref="coordenadas_tramo" />
				<xs:element ref="sector" />
			</xs:sequence>
		</xs:complexType>
	</xs:element>
	<xs:element name="largo">
		<xs:complexType>
			<xs:simpleContent>
				<xs:extension base="xs:float">
					<xs:attribute name="unidades" type="xs:string" use="required" />
				</xs:extension>
			</xs:simpleContent>
		</xs:complexType>
	</xs:element>
	<xs:element name="coordenadas_tramo">
		<xs:complexType>
			<xs:sequence>
				<xs:element ref="longitud_tramo" />
				<xs:element ref="latitud_tramo" />
				<xs:element ref="altitud_tramo" />
			</xs:sequence>
		</xs:complexType>
	</xs:element>
	<xs:element name="longitud_tramo" >
		<xs:simpleType>
			<xs:restriction base="xs:double">
				<xs:minInclusive value="-90"></xs:minInclusive>
				<xs:maxInclusive value="90"></xs:maxInclusive>
			</xs:restriction>
		</xs:simpleType>
	</xs:element>
	<xs:element name="latitud_tramo" >
		<xs:simpleType>
			<xs:restriction base="xs:double">
				<xs:minInclusive value="-90"></xs:minInclusive>
				<xs:maxInclusive value="90"></xs:maxInclusive>
			</xs:restriction>
		</xs:simpleType>
	</xs:element>
	<xs:element name="altitud_tramo" >
		<xs:simpleType>
			<xs:restriction base="xs:integer">
				<xs:minInclusive value="0"></xs:minInclusive>
				<xs:maxExclusive value="8849"></xs:maxExclusive>
			</xs:restriction>
		</xs:simpleType>
	</xs:element>
	<xs:element name="sector" >
		<xs:simpleType>
			<xs:restriction base="xs:integer">
				<xs:minInclusive value="1"></xs:minInclusive>
			</xs:restriction>
		</xs:simpleType>
	</xs:element>
	<xs:notation name="png" public="" system="image/png" />
	<xs:notation name="mp4" public="" system="video/mp4" />
</xs:schema>